{
  "$schema": "../schema/skill.schema.json",
  "id": "job_sage_free_cast",
  "name": "Свободное чтение",
  "description": "В начале боя: +20% скорости себе на 12 с.",
  "range": "ranged",
  "trigger": "battleStart",
  "target": {
    "side": "ally",
    "pick": "self"
  },
  "effects": [
    {
      "type": "status",
      "status": {
        "id": "free_cast",
        "name": "Свободное чтение",
        "turns": 12,
        "stats": {
          "spd": 0.2
        }
      }
    }
  ]
}
