{
  "$schema": "../schema/skill.schema.json",
  "id": "job_assassin_sonic_blow",
  "name": "Звуковой удар",
  "description": "Четыре молниеносных удара по цели.",
  "icon": "icon_ult_assassin",
  "range": "melee",
  "target": {
    "side": "enemy",
    "pick": "nearest",
    "row": "front"
  },
  "hits": 4,
  "effects": [
    {
      "type": "damage",
      "k": 0.6
    }
  ]
}
