{
  "$schema": "../schema/skill.schema.json",
  "id": "job_alchemist_potion_pitcher",
  "name": "Метание зелья",
  "description": "Иногда перед своим действием: лечит самого раненого союзника.",
  "range": "ranged",
  "trigger": "turnStart",
  "chance": 0.3,
  "target": {
    "side": "ally",
    "pick": "lowestHpPct",
    "includeSelf": true,
    "onlyWounded": true
  },
  "effects": [
    {
      "type": "heal",
      "k": 1
    }
  ]
}
