{
  "$schema": "../schema/skill.schema.json",
  "id": "mob_vocal_song",
  "name": "Оглушающая трель",
  "description": "Вокал стрекочет на весь луг: урон по всем врагам, 20% оглушить на ход.",
  "range": "ranged",
  "target": {
    "side": "enemy",
    "pick": "all"
  },
  "effects": [
    {
      "type": "damage",
      "k": 0.6
    },
    {
      "type": "status",
      "chance": 0.2,
      "status": {
        "id": "stun",
        "name": "Оглушение",
        "turns": 1,
        "stun": true
      }
    }
  ]
}
