{
  "$schema": "../schema/skill.schema.json",
  "id": "mage_firestorm",
  "name": "Огненный шторм",
  "description": "Урон по всем врагам.",
  "range": "ranged",
  "target": {
    "side": "enemy",
    "pick": "all"
  },
  "effects": [
    {
      "type": "damage",
      "k": 0.95
    }
  ],
  "icon": "icon_ult_mage"
}
