{
  "$schema": "../schema/skill.schema.json",
  "id": "sewer_familiar_bite",
  "name": "Укус из-под свода",
  "description": "Летучая мышь срывается со свода на ближайшего врага переднего ряда: урон и «Кровотечение» на 2 с.",
  "range": "ranged",
  "target": {
    "side": "enemy",
    "pick": "nearest",
    "row": "front"
  },
  "effects": [
    {
      "type": "dash"
    },
    {
      "type": "damage",
      "k": 1.2
    },
    {
      "type": "status",
      "status": {
        "id": "bleed",
        "name": "Кровотечение",
        "turns": 2,
        "dot": {
          "k": 0.1
        }
      }
    }
  ]
}
