{
  "id": "ro_paladin_pressure",
  "name": "Божий суд",
  "description": "Игнорирует защиту цели и отнимает у неё 35 энергии ульты.",
  "icon": "icon_ult_mage",
  "range": "ranged",
  "target": {
    "side": "enemy",
    "pick": "nearest"
  },
  "effects": [
    {
      "type": "damage",
      "k": 2.1,
      "bypassDefense": true
    },
    {
      "type": "energy",
      "amount": -35
    }
  ],
  "hits": 1,
  "cooldown": 14,
  "castTime": 0.6,
  "priority": 12
}
