{
  "$schema": "../schema/skill.schema.json",
  "id": "adv_champion_pulse",
  "name": "Пульс сферы",
  "description": "Иногда перед своим действием (шанс 25%): +6 энергии ульты.",
  "icon": "icon_ult_warrior",
  "range": "ranged",
  "target": {
    "side": "ally",
    "pick": "self"
  },
  "effects": [
    {
      "type": "energy",
      "amount": 6
    }
  ],
  "castTime": 0,
  "priority": 10,
  "trigger": "turnStart",
  "chance": 0.25
}
