{
  "$schema": "../schema/skill.schema.json",
  "id": "adv_sniper_falcon_mark",
  "name": "Метка сокола",
  "description": "Сокол метит самого израненного врага: урон (×1,65) и −15% защиты на 2 с.",
  "icon": "icon_ult_archer",
  "range": "ranged",
  "target": {
    "side": "enemy",
    "pick": "lowestHp"
  },
  "effects": [
    {
      "type": "damage",
      "k": 1.65
    },
    {
      "type": "status",
      "status": {
        "id": "adv_falcon",
        "name": "Защита",
        "turns": 2,
        "stats": {
          "def": -0.15
        }
      }
    }
  ],
  "cooldown": 9,
  "castTime": 0.25,
  "priority": 6
}
