{
  "$schema": "../schema/skill.schema.json",
  "id": "archer_volley",
  "name": "Залп",
  "description": "Несколько выстрелов по случайным врагам.",
  "range": "ranged",
  "target": {
    "side": "enemy",
    "pick": "random"
  },
  "hits": 3,
  "effects": [
    {
      "type": "damage",
      "k": 1.05
    }
  ],
  "icon": "icon_ult_archer"
}
