{
  "$schema": "../schema/skill.schema.json",
  "id": "mob2_melee_bite",
  "name": "Гнилой укус",
  "description": "Укус с ядом.",
  "range": "melee",
  "target": {
    "side": "enemy",
    "pick": "nearest"
  },
  "effects": [
    {
      "type": "damage",
      "k": 1.2
    },
    {
      "type": "status",
      "status": {
        "id": "poison",
        "name": "Яд",
        "turns": 3,
        "dot": {
          "k": 0.15
        }
      }
    }
  ]
}
