{
  "$schema": "../schema/skill.schema.json",
  "id": "job_merchant_frying_pan",
  "name": "Удар сковородой",
  "description": "Сковородой по голове (×1,6), шанс 30% оглушить на 1 ход. Личный приём Греты.",
  "range": "melee",
  "target": {
    "side": "enemy",
    "pick": "nearest",
    "row": "front"
  },
  "cooldown": 8,
  "effects": [
    {
      "type": "damage",
      "k": 1.6
    },
    {
      "type": "status",
      "chance": 0.3,
      "status": {
        "id": "stun",
        "name": "Оглушение",
        "turns": 1,
        "stun": true
      }
    }
  ]
}
