{
  "$schema": "../schema/skill.schema.json",
  "id": "maze_whisper_doubt",
  "name": "Шёпот из дупла",
  "description": "Дупла шепчут всем врагам про выгодную сделку: урон 0.5 × атака и «Сомнение» (−20% атаки) на 2 хода.",
  "range": "ranged",
  "target": {
    "side": "enemy",
    "pick": "all"
  },
  "effects": [
    {
      "type": "damage",
      "k": 0.5
    },
    {
      "type": "status",
      "status": {
        "id": "doubt",
        "name": "Сомнение",
        "turns": 2,
        "stats": {
          "atk": -0.2
        }
      }
    }
  ]
}
