{
  "$schema": "../schema/skill.schema.json",
  "id": "mob7_support_soul_dance",
  "name": "Хоровод душ",
  "description": "Души кружат над нежитью: лечат всех союзников (0.55 × атака) и дают +15% атаки на 2 с.",
  "range": "ranged",
  "target": {
    "side": "ally",
    "pick": "all",
    "includeSelf": true
  },
  "effects": [
    {
      "type": "heal",
      "k": 0.55
    },
    {
      "type": "status",
      "status": {
        "id": "souls_whisper",
        "name": "Шёпот мёртвых",
        "turns": 2,
        "stats": {
          "atk": 0.15
        }
      }
    }
  ]
}
