{
  "$schema": "../schema/skill.schema.json",
  "id": "mvp_mastering_bounce",
  "name": "Прыг-скок",
  "description": "Король порингов скачет по переднему ряду: урон 1.3 × атака каждому и 25% оглушить на 1 с.",
  "range": "melee",
  "target": {
    "side": "enemy",
    "pick": "all",
    "row": "front"
  },
  "cooldown": 8,
  "priority": 3,
  "effects": [
    {
      "type": "damage",
      "k": 1.3
    },
    {
      "type": "status",
      "chance": 0.25,
      "status": {
        "id": "stun",
        "name": "Оглушение",
        "turns": 1,
        "stun": true
      }
    }
  ]
}
