{
  "$schema": "../schema/skill.schema.json",
  "id": "job_priest_assumptio",
  "name": "Ассумптио",
  "description": "Снижает входящий урон: +50% защиты всем союзникам на 3 с.",
  "icon": "icon_ult_priest",
  "range": "ranged",
  "target": {
    "side": "ally",
    "pick": "all",
    "includeSelf": true
  },
  "cooldown": 25,
  "castTime": 1,
  "priority": 9,
  "effects": [
    {
      "type": "status",
      "status": {
        "id": "assumptio",
        "name": "Ассумптио",
        "turns": 3,
        "stats": {
          "def": 0.5
        }
      }
    }
  ]
}
